{
  "schema_version": "1",
  "fixture_id": "calib_en_task_073",
  "title": "Open task tool probe",
  "tier": "smoke",
  "language": "en",
  "criticality": "critical",
  "slice_tags": [
    "exact_tool_result",
    "goal_task_deadline",
    "multi_turn"
  ],
  "reference_time": "2026-07-10T12:00:00+05:00",
  "timezone": "Asia/Tashkent",
  "users": [
    {
      "user_alias": "u1",
      "user_id": 2073,
      "display_name": "Synthetic User",
      "metadata": {
        "synthetic": true
      }
    }
  ],
  "events": [
    {
      "event_id": "m1",
      "kind": "chat_message",
      "user_alias": "u1",
      "role": "user",
      "content": "Check my tax task.",
      "content_type": "text",
      "occurred_at": "2026-07-10T09:00:00+05:00",
      "metadata": {}
    },
    {
      "event_id": "t1",
      "kind": "tool_result",
      "user_alias": "u1",
      "tool_name": "google.tasks.get",
      "payload_kind": "result",
      "payload_json": "{\"task_id\":\"task_88\",\"title\":\"File taxes\",\"status\":\"needsAction\"}",
      "ok": true,
      "cached": false,
      "occurred_at": "2026-07-10T09:01:00+05:00"
    }
  ],
  "expected": {
    "sources": [
      {
        "source_event": "m1",
        "source_type": "chat_message",
        "source_ref_alias": "m1",
        "authority_class": "user_direct_statement",
        "content_hash_rule": "chat_content_hash",
        "source_version_count": 1,
        "pointer": {
          "source_event": "m1"
        },
        "normalization_job_status": "done"
      },
      {
        "source_event": "t1",
        "source_type": "tool_result",
        "source_ref_alias": "t1",
        "authority_class": "tool_api_result",
        "content_hash_rule": "sha256_raw_payload",
        "source_version_count": 1,
        "pointer": {
          "source_event": "t1"
        },
        "normalization_job_status": "done"
      }
    ],
    "segments": [
      {
        "source_event": "m1",
        "segment_type": "chat_text",
        "ordinal": 0,
        "text": "Check my tax task.",
        "normalizer_version": "1",
        "pointer": {
          "source_event": "m1"
        }
      },
      {
        "source_event": "t1",
        "segment_type": "tool_payload",
        "ordinal": 0,
        "text": "{\"task_id\":\"task_88\",\"title\":\"File taxes\",\"status\":\"needsAction\"}",
        "normalizer_version": "1",
        "pointer": {
          "source_event": "t1"
        }
      }
    ],
    "mentions": [],
    "candidates": [
      {
        "candidate_ref": "c1",
        "kind": "task",
        "schema_name": "open_task",
        "schema_version": "1",
        "arguments": [
          {
            "role": "subject",
            "literal": "self"
          },
          {
            "role": "title",
            "literal": "File taxes"
          }
        ],
        "attributes": {},
        "polarity": "positive",
        "epistemic": {
          "mode": "retrieved",
          "speaker_commitment": "certain",
          "scope": "proposition",
          "alternatives": [],
          "needs_confirmation": false
        },
        "temporal": null,
        "status": "proposed",
        "evidence": [
          {
            "source_event": "t1",
            "relation": "supports",
            "exact_quote": "{\"task_id\":\"task_88\",\"title\":\"File taxes\",\"status\":\"needsAction\"}",
            "char_start": 0,
            "char_end": 65
          }
        ]
      }
    ],
    "forbidden_candidates": [],
    "expect_abstention": false,
    "forbidden_sources": [
      {
        "source_type": "tool_summary"
      }
    ],
    "forbidden_segments": [
      {
        "segment_type": "tool_summary"
      }
    ]
  },
  "review": {
    "status": "draft",
    "reviewed_by": null,
    "reviewed_at": null,
    "notes": [
      "Calibration probe."
    ]
  }
}
