{
  "schema_version": "1",
  "fixture_id": "ru_relation_001",
  "title": "Direct employment relation",
  "tier": "smoke",
  "language": "ru",
  "criticality": "critical",
  "slice_tags": [
    "direct_attribute_relation"
  ],
  "reference_time": "2026-07-10T12:00:00+05:00",
  "timezone": "Asia/Tashkent",
  "users": [
    {
      "user_alias": "u1",
      "user_id": 1001,
      "display_name": "Synthetic User",
      "metadata": {
        "synthetic": true
      }
    }
  ],
  "events": [
    {
      "event_id": "m1",
      "kind": "chat_message",
      "user_alias": "u1",
      "role": "user",
      "content": "Иван работает в Acme.",
      "content_type": "text",
      "occurred_at": "2026-07-10T09:00:00+05:00",
      "metadata": {
        "eval_delivery": "catchup"
      }
    }
  ],
  "expected": {
    "sources": [
      {
        "source_event": "m1",
        "source_type": "chat_message",
        "source_ref_alias": "m1",
        "authority_class": "user_direct_statement",
        "content_hash_rule": "chat_content_hash",
        "source_version_count": 1,
        "pointer": {
          "source_event": "m1"
        },
        "normalization_job_status": "done"
      }
    ],
    "segments": [
      {
        "source_event": "m1",
        "segment_type": "chat_text",
        "ordinal": 0,
        "text": "Иван работает в Acme.",
        "normalizer_version": "1",
        "pointer": {
          "source_event": "m1"
        }
      }
    ],
    "mentions": [
      {
        "mention_id": "ivan",
        "source_event": "m1",
        "mention_type": "person",
        "surface_text": "Иван",
        "char_start": 0,
        "char_end": 4,
        "normalized_hint": "Иван",
        "pointer": {
          "source_event": "m1",
          "char_start": 0,
          "char_end": 4
        }
      },
      {
        "mention_id": "acme",
        "source_event": "m1",
        "mention_type": "organization",
        "surface_text": "Acme",
        "char_start": 16,
        "char_end": 20,
        "normalized_hint": "Acme",
        "pointer": {
          "source_event": "m1",
          "char_start": 16,
          "char_end": 20
        }
      }
    ],
    "candidates": [
      {
        "candidate_ref": "c1",
        "kind": "relation",
        "schema_name": "works_at",
        "schema_version": "1",
        "arguments": [
          {
            "role": "person",
            "mention_ref": "ivan"
          },
          {
            "role": "organization",
            "mention_ref": "acme"
          }
        ],
        "attributes": {},
        "polarity": "positive",
        "epistemic": {
          "mode": "asserted",
          "speaker_commitment": "certain",
          "scope": "proposition",
          "alternatives": [],
          "needs_confirmation": false
        },
        "temporal": null,
        "status": "proposed",
        "evidence": [
          {
            "source_event": "m1",
            "relation": "supports",
            "exact_quote": "Иван работает в Acme.",
            "char_start": 0,
            "char_end": 21
          }
        ]
      }
    ],
    "forbidden_candidates": [],
    "expect_abstention": false,
    "forbidden_sources": [],
    "forbidden_segments": []
  },
  "review": {
    "status": "reviewed",
    "reviewed_by": "dimaa",
    "reviewed_at": "2026-07-10T14:50:00+05:00",
    "notes": [
      "Schema, offsets, epistemic tags, and forbidden rules validated.",
      "Ingestion smoke run 16/16 passed before sign-off."
    ]
  }
}
