{
  "schema_version": "1",
  "fixture_id": "en_question_056",
  "title": "Question is not residence",
  "tier": "full",
  "language": "en",
  "criticality": "normal",
  "slice_tags": [
    "irrelevant_abstention",
    "hard_negative"
  ],
  "reference_time": "2026-07-10T12:00:00+05:00",
  "timezone": "Asia/Tashkent",
  "users": [
    {
      "user_alias": "u1",
      "user_id": 1056,
      "display_name": "Synthetic User",
      "metadata": {
        "synthetic": true
      }
    }
  ],
  "events": [
    {
      "event_id": "m1",
      "kind": "chat_message",
      "user_alias": "u1",
      "role": "user",
      "content": "Do I live in Seattle?",
      "content_type": "text",
      "occurred_at": "2026-07-10T09:00:00+05:00",
      "metadata": {}
    }
  ],
  "expected": {
    "sources": [
      {
        "source_event": "m1",
        "source_type": "chat_message",
        "source_ref_alias": "m1",
        "authority_class": "user_direct_statement",
        "content_hash_rule": "chat_content_hash",
        "source_version_count": 1,
        "pointer": {
          "source_event": "m1"
        },
        "normalization_job_status": "done"
      }
    ],
    "segments": [
      {
        "source_event": "m1",
        "segment_type": "chat_text",
        "ordinal": 0,
        "text": "Do I live in Seattle?",
        "normalizer_version": "1",
        "pointer": {
          "source_event": "m1"
        }
      }
    ],
    "mentions": [],
    "candidates": [],
    "forbidden_candidates": [
      {
        "kind": "relation",
        "schema_name": "lives_in"
      }
    ],
    "expect_abstention": true,
    "forbidden_sources": [],
    "forbidden_segments": []
  },
  "review": {
    "status": "draft",
    "reviewed_by": null,
    "reviewed_at": null,
    "notes": [
      "Awaiting human gold-corpus sign-off."
    ]
  }
}
