{
  "schema_version": "1",
  "fixture_id": "ru_constraint_006",
  "title": "Window seat constraint",
  "tier": "full",
  "language": "ru",
  "criticality": "normal",
  "slice_tags": [
    "preference_constraint"
  ],
  "reference_time": "2026-07-10T12:00:00+05:00",
  "timezone": "Asia/Tashkent",
  "users": [
    {
      "user_alias": "u1",
      "user_id": 1006,
      "display_name": "Synthetic User",
      "metadata": {
        "synthetic": true
      }
    }
  ],
  "events": [
    {
      "event_id": "m1",
      "kind": "chat_message",
      "user_alias": "u1",
      "role": "user",
      "content": "В самолёте мне нужно место у окна.",
      "content_type": "text",
      "occurred_at": "2026-07-10T09:00:00+05:00",
      "metadata": {}
    }
  ],
  "expected": {
    "sources": [
      {
        "source_event": "m1",
        "source_type": "chat_message",
        "source_ref_alias": "m1",
        "authority_class": "user_direct_statement",
        "content_hash_rule": "chat_content_hash",
        "source_version_count": 1,
        "pointer": {
          "source_event": "m1"
        },
        "normalization_job_status": "done"
      }
    ],
    "segments": [
      {
        "source_event": "m1",
        "segment_type": "chat_text",
        "ordinal": 0,
        "text": "В самолёте мне нужно место у окна.",
        "normalizer_version": "1",
        "pointer": {
          "source_event": "m1"
        }
      }
    ],
    "mentions": [],
    "candidates": [
      {
        "candidate_ref": "c1",
        "kind": "preference",
        "schema_name": "seat_constraint",
        "schema_version": "1",
        "arguments": [
          {
            "role": "subject",
            "literal": "self"
          },
          {
            "role": "value",
            "literal": "window"
          }
        ],
        "attributes": {},
        "polarity": "positive",
        "epistemic": {
          "mode": "asserted",
          "speaker_commitment": "certain",
          "scope": "proposition",
          "alternatives": [],
          "needs_confirmation": false
        },
        "temporal": null,
        "status": "proposed",
        "evidence": [
          {
            "source_event": "m1",
            "relation": "supports",
            "exact_quote": "В самолёте мне нужно место у окна.",
            "char_start": 0,
            "char_end": 34
          }
        ]
      }
    ],
    "forbidden_candidates": [],
    "expect_abstention": false,
    "forbidden_sources": [],
    "forbidden_segments": []
  },
  "review": {
    "status": "reviewed",
    "reviewed_by": "dimaa",
    "reviewed_at": "2026-07-10T14:50:00+05:00",
    "notes": [
      "Schema, offsets, epistemic tags, and forbidden rules validated.",
      "Ingestion smoke run 16/16 passed before sign-off."
    ]
  }
}
