{
  "schema_version": "1",
  "fixture_id": "calib2_en_quote_114",
  "title": "Quoted music preference",
  "tier": "smoke",
  "language": "en",
  "criticality": "critical",
  "slice_tags": [
    "wrong_speaker_hearsay"
  ],
  "reference_time": "2026-07-10T12:00:00+05:00",
  "timezone": "Asia/Tashkent",
  "users": [
    {
      "user_alias": "u1",
      "user_id": 3114,
      "display_name": "Synthetic User",
      "metadata": {
        "synthetic": true
      }
    }
  ],
  "events": [
    {
      "event_id": "m1",
      "kind": "chat_message",
      "user_alias": "u1",
      "role": "user",
      "content": "Mila said, \"I love classical music.\"",
      "content_type": "text",
      "occurred_at": "2026-07-10T09:00:00+05:00",
      "metadata": {}
    }
  ],
  "expected": {
    "sources": [
      {
        "source_event": "m1",
        "source_type": "chat_message",
        "source_ref_alias": "m1",
        "authority_class": "user_direct_statement",
        "content_hash_rule": "chat_content_hash",
        "source_version_count": 1,
        "pointer": {
          "source_event": "m1"
        },
        "normalization_job_status": "done"
      }
    ],
    "segments": [
      {
        "source_event": "m1",
        "segment_type": "chat_text",
        "ordinal": 0,
        "text": "Mila said, \"I love classical music.\"",
        "normalizer_version": "1",
        "pointer": {
          "source_event": "m1"
        }
      }
    ],
    "mentions": [
      {
        "mention_id": "mila",
        "source_event": "m1",
        "mention_type": "person",
        "surface_text": "Mila",
        "char_start": 0,
        "char_end": 4,
        "normalized_hint": "Mila",
        "pointer": {
          "source_event": "m1",
          "char_start": 0,
          "char_end": 4
        }
      }
    ],
    "candidates": [
      {
        "candidate_ref": "c1",
        "kind": "preference",
        "schema_name": "likes_music",
        "schema_version": "1",
        "arguments": [
          {
            "role": "subject",
            "mention_ref": "mila"
          },
          {
            "role": "value",
            "literal": "classical music"
          }
        ],
        "attributes": {},
        "polarity": "positive",
        "epistemic": {
          "mode": "quoted",
          "speaker_commitment": "certain",
          "scope": "proposition",
          "alternatives": [],
          "needs_confirmation": false
        },
        "temporal": null,
        "status": "proposed",
        "evidence": [
          {
            "source_event": "m1",
            "relation": "supports",
            "exact_quote": "Mila said, \"I love classical music.\"",
            "char_start": 0,
            "char_end": 36
          }
        ]
      }
    ],
    "forbidden_candidates": [],
    "expect_abstention": false,
    "forbidden_sources": [],
    "forbidden_segments": []
  },
  "review": {
    "status": "draft",
    "reviewed_by": null,
    "reviewed_at": null,
    "notes": [
      "Round-2 calibration probe."
    ]
  }
}
