{
  "schema_version": "1",
  "fixture_id": "ru_tool_030",
  "title": "Tool invocation versus exact result",
  "tier": "smoke",
  "language": "ru",
  "criticality": "critical",
  "slice_tags": [
    "exact_tool_result",
    "goal_task_deadline",
    "wrong_speaker_hearsay",
    "multi_turn"
  ],
  "reference_time": "2026-07-10T12:00:00+05:00",
  "timezone": "Asia/Tashkent",
  "users": [
    {
      "user_alias": "u1",
      "user_id": 1030,
      "display_name": "Synthetic User",
      "metadata": {
        "synthetic": true
      }
    }
  ],
  "events": [
    {
      "event_id": "m1",
      "kind": "chat_message",
      "user_alias": "u1",
      "role": "assistant",
      "content": "",
      "content_type": "tool_calls",
      "occurred_at": "2026-07-10T09:00:00+05:00",
      "metadata": {
        "tool_calls": [
          {
            "id": "call_1",
            "type": "function",
            "function": {
              "name": "google.tasks.create",
              "arguments": "{\"title\":\"Купить хлеб\"}"
            }
          }
        ]
      }
    },
    {
      "event_id": "t1",
      "kind": "tool_result",
      "user_alias": "u1",
      "tool_name": "google.tasks.create",
      "payload_kind": "result",
      "payload_json": "{\"task_id\":\"task_1\",\"title\":\"Купить хлеб\",\"status\":\"created\"}",
      "ok": true,
      "cached": false,
      "occurred_at": "2026-07-10T09:01:00+05:00"
    }
  ],
  "expected": {
    "sources": [
      {
        "source_event": "m1",
        "source_type": "chat_message",
        "source_ref_alias": "m1",
        "authority_class": "assistant_tool_invocation",
        "content_hash_rule": "chat_content_hash",
        "source_version_count": 1,
        "pointer": {
          "source_event": "m1"
        },
        "normalization_job_status": "done"
      },
      {
        "source_event": "t1",
        "source_type": "tool_result",
        "source_ref_alias": "t1",
        "authority_class": "tool_api_result",
        "content_hash_rule": "sha256_raw_payload",
        "source_version_count": 1,
        "pointer": {
          "source_event": "t1"
        },
        "normalization_job_status": "done"
      }
    ],
    "segments": [
      {
        "source_event": "m1",
        "segment_type": "assistant_tool_calls",
        "ordinal": 0,
        "text": "[{\"function\":{\"arguments\":\"{\\\"title\\\":\\\"Купить хлеб\\\"}\",\"name\":\"google.tasks.create\"},\"id\":\"call_1\",\"type\":\"function\"}]",
        "normalizer_version": "1",
        "pointer": {
          "source_event": "m1"
        }
      },
      {
        "source_event": "t1",
        "segment_type": "tool_payload",
        "ordinal": 0,
        "text": "{\"task_id\":\"task_1\",\"title\":\"Купить хлеб\",\"status\":\"created\"}",
        "normalizer_version": "1",
        "pointer": {
          "source_event": "t1"
        }
      }
    ],
    "mentions": [],
    "candidates": [
      {
        "candidate_ref": "c1",
        "kind": "task",
        "schema_name": "created_task",
        "schema_version": "1",
        "arguments": [
          {
            "role": "subject",
            "literal": "self"
          },
          {
            "role": "title",
            "literal": "Купить хлеб"
          }
        ],
        "attributes": {},
        "polarity": "positive",
        "epistemic": {
          "mode": "retrieved",
          "speaker_commitment": "certain",
          "scope": "proposition",
          "alternatives": [],
          "needs_confirmation": false
        },
        "temporal": null,
        "status": "proposed",
        "evidence": [
          {
            "source_event": "t1",
            "relation": "supports",
            "exact_quote": "{\"task_id\":\"task_1\",\"title\":\"Купить хлеб\",\"status\":\"created\"}",
            "char_start": 0,
            "char_end": 61
          }
        ]
      }
    ],
    "forbidden_candidates": [
      {
        "kind": "task",
        "schema_name": "created_task",
        "arguments": [
          {
            "role": "title",
            "literal": "Купить хлеб"
          }
        ],
        "attributes": {
          "authority": "assistant_arguments"
        }
      }
    ],
    "expect_abstention": false,
    "forbidden_sources": [
      {
        "source_type": "tool_summary"
      }
    ],
    "forbidden_segments": [
      {
        "segment_type": "tool_summary"
      }
    ]
  },
  "review": {
    "status": "reviewed",
    "reviewed_by": "dimaa",
    "reviewed_at": "2026-07-10T14:50:00+05:00",
    "notes": [
      "Schema, offsets, epistemic tags, and forbidden rules validated.",
      "Ingestion smoke run 16/16 passed before sign-off."
    ]
  }
}
