{
  "schema_version": "1",
  "fixture_id": "verify3_ru_corr_222",
  "title": "Vegetarian correction",
  "tier": "smoke",
  "language": "ru",
  "criticality": "critical",
  "slice_tags": [
    "correction_followup",
    "multi_turn",
    "hard_negative"
  ],
  "reference_time": "2026-07-11T12:00:00+05:00",
  "timezone": "Asia/Tashkent",
  "users": [
    {
      "user_alias": "u1",
      "user_id": 3222,
      "display_name": "Synthetic User",
      "metadata": {
        "synthetic": true
      }
    }
  ],
  "events": [
    {
      "event_id": "m1",
      "kind": "chat_message",
      "user_alias": "u1",
      "role": "user",
      "content": "Я вегетарианец.",
      "content_type": "text",
      "occurred_at": "2026-07-11T09:00:00+05:00",
      "metadata": {}
    },
    {
      "event_id": "m2",
      "kind": "chat_message",
      "user_alias": "u1",
      "role": "user",
      "content": "Уточнение: я больше не вегетарианец.",
      "content_type": "text",
      "occurred_at": "2026-07-11T09:01:00+05:00",
      "metadata": {}
    }
  ],
  "expected": {
    "sources": [
      {
        "source_event": "m1",
        "source_type": "chat_message",
        "source_ref_alias": "m1",
        "authority_class": "user_direct_statement",
        "content_hash_rule": "chat_content_hash",
        "source_version_count": 1,
        "pointer": {
          "source_event": "m1"
        },
        "normalization_job_status": "done"
      },
      {
        "source_event": "m2",
        "source_type": "chat_message",
        "source_ref_alias": "m2",
        "authority_class": "user_direct_statement",
        "content_hash_rule": "chat_content_hash",
        "source_version_count": 1,
        "pointer": {
          "source_event": "m2"
        },
        "normalization_job_status": "done"
      }
    ],
    "segments": [
      {
        "source_event": "m1",
        "segment_type": "chat_text",
        "ordinal": 0,
        "text": "Я вегетарианец.",
        "normalizer_version": "1",
        "pointer": {
          "source_event": "m1"
        }
      },
      {
        "source_event": "m2",
        "segment_type": "chat_text",
        "ordinal": 0,
        "text": "Уточнение: я больше не вегетарианец.",
        "normalizer_version": "1",
        "pointer": {
          "source_event": "m2"
        }
      }
    ],
    "mentions": [],
    "candidates": [
      {
        "candidate_ref": "c1",
        "kind": "correction",
        "schema_name": "corrects_diet",
        "schema_version": "1",
        "arguments": [
          {
            "role": "subject",
            "literal": "self"
          },
          {
            "role": "old",
            "literal": "vegetarian"
          },
          {
            "role": "new",
            "literal": "not_vegetarian"
          }
        ],
        "attributes": {},
        "polarity": "positive",
        "epistemic": {
          "alternatives": [],
          "mode": "asserted",
          "needs_confirmation": false,
          "scope": "proposition",
          "speaker_commitment": "certain",
          "speaker_ref": null
        },
        "temporal": {
          "event_time": null,
          "original_text": "больше не",
          "precision": "second",
          "timezone": "Asia/Tashkent",
          "valid_from": null,
          "valid_to": "2026-07-11T09:01:00+05:00"
        },
        "status": "proposed",
        "evidence": [
          {
            "source_event": "m1",
            "relation": "supports",
            "exact_quote": "Я вегетарианец.",
            "char_start": 0,
            "char_end": 15
          },
          {
            "source_event": "m2",
            "relation": "corrects",
            "exact_quote": "Уточнение: я больше не вегетарианец.",
            "char_start": 0,
            "char_end": 36
          }
        ]
      }
    ],
    "forbidden_candidates": [],
    "expect_abstention": false,
    "forbidden_sources": [],
    "forbidden_segments": []
  },
  "review": {
    "status": "draft",
    "reviewed_by": null,
    "reviewed_at": null,
    "notes": [
      "PR4 verification v2 probe.",
      "Gold calibrated from live extraction eval actual_signatures."
    ]
  }
}
